{
  "assets": {
    "aggregating-anemone": {
      "bytes": 48540,
      "content_type": "image/webp",
      "path": "media/aggregating-anemone-v1.webp",
      "revision": 1,
      "sha256": "99ad74f4d75359cd114684e93e8c04151cb2b6fa98a3063329f8bb5a22d6f71f"
    },
    "bat-star": {
      "bytes": 103400,
      "content_type": "image/webp",
      "path": "media/bat-star-v1.webp",
      "revision": 1,
      "sha256": "7bbc91ff884b18959f75363de8a5dbd289cfd3482a5db08957ee3d43441f39eb"
    },
    "bird-rock-reef-context": {
      "bytes": 87322,
      "content_type": "image/webp",
      "path": "media/bird-rock-reef-context-v1.webp",
      "revision": 1,
      "sha256": "ff73bd6f62623965b1b4bab9a3c420f9ec0e2d31ec561b97780a56b00118d27b"
    },
    "bird-rock-reef-photo-01": {
      "bytes": 172408,
      "content_type": "image/webp",
      "path": "media/bird-rock-reef-photo-01-v1.webp",
      "revision": 1,
      "sha256": "b02da05679a0e25cec5a7dbcfe5224d9bf2b4f9684e4dde8481085e18537ee92"
    },
    "bird-rock-reef-photo-02": {
      "bytes": 151410,
      "content_type": "image/webp",
      "path": "media/bird-rock-reef-photo-02-v1.webp",
      "revision": 1,
      "sha256": "1f31ec0b55bb3b8fcd00440dfdc134116961d14f716cbad2e29628e01f9729da"
    },
    "bird-rock-reef-photo-07": {
      "bytes": 179354,
      "content_type": "image/webp",
      "path": "media/bird-rock-reef-photo-07-v1.webp",
      "revision": 1,
      "sha256": "1898703f88769dc8b3d7363cc2191f630ae08f447c438cfe5e4b4c6e7dc71385"
    },
    "bird-rock-reef-photo-08": {
      "bytes": 178284,
      "content_type": "image/webp",
      "path": "media/bird-rock-reef-photo-08-v1.webp",
      "revision": 1,
      "sha256": "9f61dbc4e9bbad5d494099cc57484b807bac8eefb95b3b9e1f1a898c6220a0d1"
    },
    "bird-rock-reef-photo-09": {
      "bytes": 174306,
      "content_type": "image/webp",
      "path": "media/bird-rock-reef-photo-09-v1.webp",
      "revision": 1,
      "sha256": "2176df35277cb240aa64f833d17a803c21c85eedb417bffa471ccb1e07acd784"
    },
    "bird-rock-reef-photo-10": {
      "bytes": 134804,
      "content_type": "image/webp",
      "path": "media/bird-rock-reef-photo-10-v1.webp",
      "revision": 1,
      "sha256": "57aa04741e0a110f62ef2f91615a5a4496d64365d18d79d8b9d080d097dc2906"
    },
    "black-oystercatcher": {
      "bytes": 44014,
      "content_type": "image/webp",
      "path": "media/black-oystercatcher-v1.webp",
      "revision": 1,
      "sha256": "8f7e420cb9708d8122c498197a624185ba0d9410dc517693737f690929e49736"
    },
    "black-turban-snail": {
      "bytes": 86504,
      "content_type": "image/webp",
      "path": "media/black-turban-snail-v1.webp",
      "revision": 1,
      "sha256": "d18e3a0e97a87a0a9df7b70122a9debf29c017c748280b7b504f48b99d9dae91"
    },
    "brandt-cormorant": {
      "bytes": 24040,
      "content_type": "image/webp",
      "path": "media/brandt-cormorant-v1.webp",
      "revision": 1,
      "sha256": "24d423bb8745c645d44ab986d585aee2d79cde4820f742d541cb9104f97c48e5"
    },
    "cabrillo-profile": {
      "bytes": 365878,
      "content_type": "image/webp",
      "path": "media/cabrillo-profile-v1.webp",
      "revision": 1,
      "sha256": "8632723af850071526b927f77f4089c1d7045e9828d52689706908cc684ded11"
    },
    "cabrillo-tidepools-photo-01": {
      "bytes": 346808,
      "content_type": "image/webp",
      "path": "media/cabrillo-tidepools-photo-01-v1.webp",
      "revision": 1,
      "sha256": "5b59f95b23388c62493ec20f7c2be92d29ec2972b516f6235ff9c9a3cfb4efb9"
    },
    "cabrillo-tidepools-photo-03": {
      "bytes": 441578,
      "content_type": "image/webp",
      "path": "media/cabrillo-tidepools-photo-03-v1.webp",
      "revision": 1,
      "sha256": "82d125e7c7acad07e9cc6db138e3a7106d5cee6410f7819de6aa6b6a4ce7582f"
    },
    "cabrillo-tidepools-photo-04": {
      "bytes": 356300,
      "content_type": "image/webp",
      "path": "media/cabrillo-tidepools-photo-04-v1.webp",
      "revision": 1,
      "sha256": "23d11b42a003f79b23d76734795c463b079c6faf77f8e1e6f380b7c1225656a3"
    },
    "cabrillo-tidepools-photo-05": {
      "bytes": 215276,
      "content_type": "image/webp",
      "path": "media/cabrillo-tidepools-photo-05-v1.webp",
      "revision": 1,
      "sha256": "d4cec3bce0213b51385414a1ca2e5ce43e6d45a62f509754a9e6539c64fcb5ed"
    },
    "cabrillo-tidepools-photo-06": {
      "bytes": 242470,
      "content_type": "image/webp",
      "path": "media/cabrillo-tidepools-photo-06-v1.webp",
      "revision": 1,
      "sha256": "08245168131b431651720d628034b8809d77c597f034c75b7a468591ab97eea8"
    },
    "cabrillo-tidepools-photo-07": {
      "bytes": 218628,
      "content_type": "image/webp",
      "path": "media/cabrillo-tidepools-photo-07-v1.webp",
      "revision": 1,
      "sha256": "3fd98f59bbcad9b332b7fb73b921548fa31a4e547f64bb0bfd57c350bed4b572"
    },
    "california-mussel": {
      "bytes": 48838,
      "content_type": "image/webp",
      "path": "media/california-mussel-v1.webp",
      "revision": 1,
      "sha256": "c9ef9bef9ddfc17e2584576713dc31021062a576f13ea2941729615a1ef92606"
    },
    "california-sea-hare": {
      "bytes": 57676,
      "content_type": "image/webp",
      "path": "media/california-sea-hare-v1.webp",
      "revision": 1,
      "sha256": "99d747863f60295290aa8bf08ce3e5658108aa86142346e7fdaaa249efad7e86"
    },
    "california-sea-lion": {
      "bytes": 19742,
      "content_type": "image/webp",
      "path": "media/california-sea-lion-v1.webp",
      "revision": 1,
      "sha256": "2c65cce20804f197f510d4039cde4b5ff3fff6b767ddb788d9d6867d2744140a"
    },
    "childrens-pool-casa-beach-photo-01": {
      "bytes": 245968,
      "content_type": "image/webp",
      "path": "media/childrens-pool-casa-beach-photo-01-v1.webp",
      "revision": 1,
      "sha256": "6e22703d92c7ef8ec4c01ad3d693bcb0042e32207bc04bd63765b18015f0c4cf"
    },
    "childrens-pool-casa-beach-photo-02": {
      "bytes": 203304,
      "content_type": "image/webp",
      "path": "media/childrens-pool-casa-beach-photo-02-v1.webp",
      "revision": 1,
      "sha256": "596f1dff167408755bf84d85f6028e386581910ab841f424964a5e39f72202c7"
    },
    "childrens-pool-casa-beach-photo-03": {
      "bytes": 152722,
      "content_type": "image/webp",
      "path": "media/childrens-pool-casa-beach-photo-03-v1.webp",
      "revision": 1,
      "sha256": "1aaafd4607127da9ad2634ce4bc98370d73bba7c1cb46c368959fe524fc9b62d"
    },
    "childrens-pool-casa-beach-photo-04": {
      "bytes": 255162,
      "content_type": "image/webp",
      "path": "media/childrens-pool-casa-beach-photo-04-v1.webp",
      "revision": 1,
      "sha256": "79e27c9bfb3663aa8cac681221bfde0e3f2c79ffe9c076da2cd3de008918521c"
    },
    "childrens-pool-profile": {
      "bytes": 290798,
      "content_type": "image/webp",
      "path": "media/childrens-pool-profile-v1.webp",
      "revision": 1,
      "sha256": "24d0d26d488bd85e7dc06bc15db4cb5bbffdd86bf350041876ccb47d57e1b4d9"
    },
    "conspicuous-chiton": {
      "bytes": 38094,
      "content_type": "image/webp",
      "path": "media/conspicuous-chiton-v1.webp",
      "revision": 1,
      "sha256": "a47f9315b7c3cdea56be2a0008ea8ddc6bd90d7177934c5989becc9c8359d112"
    },
    "coralline-algae": {
      "bytes": 78802,
      "content_type": "image/webp",
      "path": "media/coralline-algae-v1.webp",
      "revision": 1,
      "sha256": "9f0fe8b0f3c63ad71e7efe81c5576845354f099610666e454d138efce4c5a0af"
    },
    "dike-rock-context": {
      "bytes": 179822,
      "content_type": "image/webp",
      "path": "media/dike-rock-context-v1.webp",
      "revision": 1,
      "sha256": "3a4a676a040aefa2e5f3cb6adf51670105477667a6a6de30cab8f0e38431cc50"
    },
    "dike-rock-scripps-beach-photo-04": {
      "bytes": 120532,
      "content_type": "image/webp",
      "path": "media/dike-rock-scripps-beach-photo-04-v1.webp",
      "revision": 1,
      "sha256": "2a299dbec2b0817c873b71376013836ee8db90aa10c2f79674c6243c36ce27e8"
    },
    "dike-rock-scripps-beach-photo-07": {
      "bytes": 178724,
      "content_type": "image/webp",
      "path": "media/dike-rock-scripps-beach-photo-07-v1.webp",
      "revision": 1,
      "sha256": "455c7938cd39389d34cb5f44487576e287e028fcb2e003aafbe633538447be92"
    },
    "dike-rock-scripps-beach-photo-08": {
      "bytes": 97486,
      "content_type": "image/webp",
      "path": "media/dike-rock-scripps-beach-photo-08-v1.webp",
      "revision": 1,
      "sha256": "ddc48d15708242ed2be2ca4527cbce5f43d6f3323181238c6d0ec33eea5d737a"
    },
    "dike-rock-scripps-beach-photo-09": {
      "bytes": 129632,
      "content_type": "image/webp",
      "path": "media/dike-rock-scripps-beach-photo-09-v1.webp",
      "revision": 1,
      "sha256": "5e5cf4098eb0e8934b097b3cfdc41bbb631f87a45cd8ccd356c468353ce28a9f"
    },
    "dike-rock-scripps-beach-photo-10": {
      "bytes": 286900,
      "content_type": "image/webp",
      "path": "media/dike-rock-scripps-beach-photo-10-v1.webp",
      "revision": 1,
      "sha256": "f585c2f22fd73ef87e6fd6598c33851d6d6dc8cdd44304417c47e58d73f6e2ed"
    },
    "dike-rock-scripps-beach-photo-11": {
      "bytes": 470820,
      "content_type": "image/webp",
      "path": "media/dike-rock-scripps-beach-photo-11-v1.webp",
      "revision": 1,
      "sha256": "2dffdc108b0fdb3565a0758fc04952f74a23bdfd631981536be144872b1a3ad6"
    },
    "garibaldi": {
      "bytes": 22770,
      "content_type": "image/webp",
      "path": "media/garibaldi-v1.webp",
      "revision": 1,
      "sha256": "d795c28206de9549829d830010c906701e20c557d0c2c6bb725db4b627c415ea"
    },
    "harbor-seal": {
      "bytes": 23564,
      "content_type": "image/webp",
      "path": "media/harbor-seal-v1.webp",
      "revision": 1,
      "sha256": "eb98af7f26934c0df6041357b041b7d379d363ae74800e81c7032173556659af"
    },
    "hospital-point-photo-01": {
      "bytes": 82884,
      "content_type": "image/webp",
      "path": "media/hospital-point-photo-01-v1.webp",